{
  "contract": "earlysignal-data-v1",
  "labeler": "keyword",
  "status": "complete",
  "files": [
    "console.json",
    "meta.json",
    "cases.json",
    "cases/PE14017.json",
    "cases/PE14022.json",
    "cases/PE14028.json",
    "cases/PE14030.json",
    "cases/PE15003.json",
    "cases/PE15012.json",
    "cases/PE15028.json",
    "cases/PE15029.json",
    "cases/PE16003.json",
    "cases/PE16013.json",
    "cases/PE16016.json",
    "cases/PE16018.json",
    "cases/PE17003.json",
    "cases/PE17007.json",
    "cases/PE18003.json",
    "cases/PE18006.json",
    "cases/PE18008.json",
    "cases/PE18010.json",
    "cases/PE18011.json",
    "cases/PE18016.json",
    "cases/PE19003.json",
    "cases/PE19004.json",
    "cases/PE19008.json",
    "cases/PE19009.json",
    "cases/PE20014.json",
    "cases/PE20016.json",
    "cases/PE21005.json",
    "cases/PE21009.json",
    "cases/PE21022.json",
    "cases/PE22008.json",
    "cases/PE23001.json",
    "cases/PE23002.json",
    "cases/PE23006.json",
    "cases/PE23011.json",
    "cases/PE23021.json",
    "cases/PE23023.json",
    "cases/PE24002.json",
    "cases/PE24010.json"
  ],
  "console_months": 8,
  "console_groups": 9,
  "complaints": 2142,
  "evidence_cells": 400,
  "briefs": 0,
  "cases": 38,
  "file_sha256": {
    "console.json": "3e19042ff94dcc4188d1f976873c85f76cb89d2feaecf239ae1c137926473260",
    "meta.json": "61c2c8c29e9400368c2ca6b02261639506883a7a7eff81f8c2ced5e610768d66",
    "cases.json": "89c4f0f1e42a8b6f7876bfc93fdbab7c07e39a2b3b295338691e7e937f91005d",
    "cases/PE14017.json": "807bee2b9782699e6e9e754da6d48621934963cd2ce8c06f885dcbaf046d3e92",
    "cases/PE14022.json": "17b7eacb06d32c60218daf1a03c3ac4e134593cf7f4293c2bf61a8f0076a2a30",
    "cases/PE14028.json": "31b46a62d275c582d31cee1ea389ed3315838b0fb5ecd438bd77d3055cfb1992",
    "cases/PE14030.json": "0b019df08faf6890d362a8ad1ea4530cd76e8b5c0b4be92de544a8f254b3703e",
    "cases/PE15003.json": "46ee6b6d0a485e8999fb101255f41e6776d7933fb260ecb25ae4d447a10572df",
    "cases/PE15012.json": "ea8b099ddb503e1b5658b9f39e0aef3db48a6bbd0bc6aac54394497c488634ec",
    "cases/PE15028.json": "215e9ae08ae969437792b508aafdbd8c8345c2cc56525a785a9be5d7b4daeb47",
    "cases/PE15029.json": "e7845b9d01a107aedc9ade35746fce77b96d07c6aa44500dc5a86cc0359d0fe6",
    "cases/PE16003.json": "46960905a5befed7d63714dbd87ba28efa6fb9daac0cf3cfdeae7474ba99c1cc",
    "cases/PE16013.json": "e6cda01d08813a401c08ab16e583365ecd7a694e5cab2bb29d6f684cdf8d4346",
    "cases/PE16016.json": "02e5dce063a7853cb2f21e04a5b95bd3fe8451883836b1a79047604840a641d5",
    "cases/PE16018.json": "b2130d98176df9a08e3498bd624ec5c7d98fb088a0b013792161e998b5c48b88",
    "cases/PE17003.json": "59d780985044160d35bff24b9d9f0a2d19e69d8c1fd46cdd7ce19d5a1b69bba5",
    "cases/PE17007.json": "0612b1d26f102a2bcbe2e890a723dea2c0b5bd140d426a42f74d3a054df44f8f",
    "cases/PE18003.json": "773e441f85e2797e34b57322d5bb017e2d425c0d3b6fac962c5a61950faedbc7",
    "cases/PE18006.json": "13ed8753d8e9988ec7009596794a226842802d2d3928951d6e85f1de6f2da2ac",
    "cases/PE18008.json": "22b62bd973b9fce1f2425a3212cadfe04b090f343a69b50c11a1c3157ee82aa3",
    "cases/PE18010.json": "2fb06b55929cf686eaeaefbca36dfb519766c4a0a41ab3947ee4a429eefc36f7",
    "cases/PE18011.json": "f68341e9ee7151289cae49c0dade19c25b67a994496aca2338dfcce2b67f81a0",
    "cases/PE18016.json": "5fda4f9c16d9677e6448a2cba9543d80efa2eb6ba786fad70f92eac0737c7e3c",
    "cases/PE19003.json": "541d239bc4c5f34de2ee5530cc1af68eed29de55d592c6e77078777080bcc04e",
    "cases/PE19004.json": "b72fcd6b42bd870807af8969dccb08425ee718c45f88f6131d061df78f911749",
    "cases/PE19008.json": "9fc6d2294bcea1b2f102c8ec346745479a43b8a8dab488210751721fc604d26d",
    "cases/PE19009.json": "f935619da13031dc23a7be7e0c74703d320913f2e8e865a5c83536857b7c00ed",
    "cases/PE20014.json": "c5dfb2a89d32daf6fb2041307169f33322ad63c6bb2157e584011fc0d84bed6a",
    "cases/PE20016.json": "8b521b614d00bb1b86d168c1c491e4139f0d340424ff6b63c5d8f67419978a9d",
    "cases/PE21005.json": "c3c79f97d939b99e52e0de8a4122a73941305cfc10ffe866ef90460d10b61564",
    "cases/PE21009.json": "a325db1c44262ef9709dec7287a0adc2738068d52ad12814acdc692c04b3efa5",
    "cases/PE21022.json": "f669bbd880a5a0f7ef0103eb6b4d0b1a12b6a8e7116a719b057bfb62a3364096",
    "cases/PE22008.json": "9de69087234854ca8e25d723c26ed375769b007797e0654daa0d15eca47e289d",
    "cases/PE23001.json": "b384a94c580b053bc45e56641966bdac07eb054a8ac9b59f6c5d09ce4d3fba64",
    "cases/PE23002.json": "c924362238f83991759558f484c6d487880f06c59613adaffbc3a4589b2a8339",
    "cases/PE23006.json": "24fdce798eba97167d2feb25d3bec55566b57c07b520ae6ea21089ade71144bd",
    "cases/PE23011.json": "e9be86d713a4f0bceccce0075bcb5d3a6cfe27d82eb7963fe68be6f7462fde3c",
    "cases/PE23021.json": "ab1af73b7700c389a493ed1c7375165393206b4a4ebf0a347d98642ab5d69a0f",
    "cases/PE23023.json": "4f093566a165c1999323d135c4d276bca90e3f5b3208612fb8c9575ced6fe0d0",
    "cases/PE24002.json": "0a8ee530c5dcdad892af783a1d8a7d17e2e11306478da5795aaf2dcf1d2cf239",
    "cases/PE24010.json": "e6bb187615f51a2b8da18ab7c28d86f3cf7fcdf9dd96b16c546146e59a2660f3"
  }
}
